[
  {
    "word": "himae",
    "ipa": "/hi.ˈma.e/",
    "pos": [
      "noun"
    ],
    "concept": "Head / Mind-case",
    "description": "The upper part of the body, containing the brain and the eyes, ears, nose, and mouth.",
    "rationale": "Combines 'hi' (breath/life) with 'mae' (a sound suggesting containment or a vessel). The meaning is 'the vessel of the breath/life/mind,' a fitting description for the head.",
    "tags": [
      "anatomy",
      "body"
    ]
  },
  {
    "word": "phale",
    "ipa": "/ˈɸa.le/",
    "pos": [
      "noun"
    ],
    "concept": "Hand / Taker / Giver",
    "description": "The part of a person's body at the end of the arm, used for holding, moving, touching, and feeling things.",
    "rationale": "The word combines 'pha' (the proximal particle, 'this') with 'le' (a flowing, connective sound). This constructs the meaning 'the thing here that connects/flows,' which beautifully describes the hand's role in interacting with the immediate environment.",
    "tags": [
      "anatomy",
      "body",
      "tool"
    ]
  },
  {
    "word": "shio",
    "ipa": "/ˈʃi.o/",
    "pos": [
      "noun"
    ],
    "concept": "Eye / Seer",
    "description": "The organ of sight.",
    "rationale": "This word is a nominalized form of the verb 'shipe' (to see/observe). The 'io' ending creates a noun that means 'the instrument of seeing.'",
    "tags": [
      "anatomy",
      "body",
      "sense"
    ]
  }
] 