[
  {
    "word": "theula",
    "ipa": "/θe.ˈu.la/",
    "pos": [ "descriptor" ],
    "concept": "All / The Whole",
    "description": "A quantifying descriptor representing the entirety of a set; the complete whole.",
    "rationale": "The word is designed to feel encompassing. It starts with the gentle fricative 'the', flows through the wide vowel pair 'eu' (pronounced in hiatus as /e.u/), and ends with the open, flowing 'la' syllable. The sound unspools from a point into a broad, open space.",
    "tags": [ "quantifier", "modifier", "totality" ]
  },
  {
    "word": "sheloi",
    "ipa": "/ʃe.ˈlo.i/",
    "pos": [ "descriptor" ],
    "concept": "Many / Much",
    "description": "A quantifying descriptor representing a large, indefinite number or amount.",
    "rationale": "The soft, rustling 'she' sound evokes a multitude, like leaves on a tree or grains of sand. The 'loi' vowel pair (pronounced /o.i/) feels plural and numerous, like a count that continues into a fine point.",
    "tags": [ "quantifier", "modifier", "multitude" ]
  },
  {
    "word": "phina",
    "ipa": "/ˈɸi.na/",
    "pos": [ "descriptor" ],
    "concept": "Few / A Little",
    "description": "A quantifying descriptor representing a small, indefinite number or amount.",
    "rationale": "The word sounds delicate and minimal. The initial fricative 'phi' is a soft, breathy puff of air, suggesting a small quantity. The simple, grounded 'na' syllable gives it a sense of a definite but small amount.",
    "tags": [ "quantifier", "modifier", "paucity" ]
  },
  {
    "word": "thoma",
    "ipa": "/ˈθo.ma/",
    "pos": [ "descriptor" ],
    "concept": "Some / A Part Of",
    "description": "A quantifying descriptor representing an indefinite, partial amount of a whole.",
    "rationale": "This word feels like a 'considered portion.' The thoughtful fricative 'tho' suggests a deliberate selection, and the definite syllable 'ma' represents the concrete but partial amount being taken from a whole.",
    "tags": [ "quantifier", "modifier", "partial" ]
  },
  {
    "word": "phaino",
    "ipa": "/ɸa.ˈi.no/",
    "pos": [ "descriptor" ],
    "concept": "Each / Every",
    "description": "A quantifying descriptor that refers to every member of a set, considered individually.",
    "rationale": "A word for distributive focus. The sharp vowel pair 'ai' (pronounced /a.i/) suggests a series of distinct, individual points. It's preceded by the soft 'ph' fricative and followed by the syllable 'no', grounding the concept in a mindful observation of each individual thing in a set.",
    "tags": [ "quantifier", "modifier", "distributive" ]
  },
  {
    "word": "mawha",
    "ipa": "/ˈma.ʍa/",
    "pos": [ "descriptor" ],
    "concept": "No / None / Zero",
    "description": "A quantifying descriptor representing the complete absence of quantity.",
    "rationale": "This word is built to sound like an absence. It begins with a sound shared with the negation particle 'ma', immediately establishing a lack. It is followed by 'wha', a voiceless, breathy fricative that sounds like an empty exhalation—the sound of nothing.",
    "tags": [ "quantifier", "modifier", "absence" ]
  },
  {
    "word": "soli",
    "ipa": "/ˈso.li/",
    "pos": [ "descriptor", "quantifier" ],
    "concept": "Several",
    "description": "A quantifying descriptor for a small, countable number of items, more than a few but not many.",
    "rationale": "The word is designed to feel like a small, distinct group. The initial 's' gives it a soft plurality, while the 'o' and 'li' syllables feel like a sequence of countable units. It is phonetically balanced and distinct from 'sheloi' (many) and 'phina' (few).",
    "tags": [ "quantifier", "modifier", "countable" ]
  }
] 